"Variable / Field Name","Form Name","Section Header","Field Type","Field Label","Choices, Calculations, OR Slider Labels","Field Note","Text Validation Type OR Show Slider Number","Text Validation Min","Text Validation Max","Identifier?","Branching Logic (Show field only if...)","Required Field?","Custom Alignment","Question Number (surveys only)","Matrix Group Name","Matrix Ranking?","Field Annotation"
"phenx_acute_subjective_response_to_substances_current_gene_record_id","px520103_phenx_acute_subjective_response_to_substances_current_gene",,"text","Record ID",,"PX520103",,,,,,,,,,"",
"instructions_520103","px520103_phenx_acute_subjective_response_to_substances_current_gene",,"descriptive","You will be asked to indicate your answers to the following questions about the drug you consumed by marking on the line to indicate how much the adjective or description applies to you. Please indicate how you are feeling right now by using  the image below to measure the result  in mm for every question.",,"PX520103",,,,,,,,,,"",""
"line","px520103_phenx_acute_subjective_response_to_substances_current_gene",,"descriptive","Image_line.jpg",,"PX520103",,,,,,,,,,"",""
"feel_drug_effect_now","px520103_phenx_acute_subjective_response_to_substances_current_gene",,"text","Do you FEEL a drug effect right now?",,"PX520103",,,,,,,,,,"",""
"like_effects_you_are_feeling","px520103_phenx_acute_subjective_response_to_substances_current_gene",,"text","Do you LIKE any of the effects you are feeling right now?",,"PX520103",,,,,,,,,,"",""
"dislike_effects_you_are_feeling","px520103_phenx_acute_subjective_response_to_substances_current_gene",,"text","Do you DISLIKE any of the effects you are feeling right now?",,"PX520103",,,,,,,,,,"",""
"are_you_high","px520103_phenx_acute_subjective_response_to_substances_current_gene",,"text","Are you HIGH right now?",,"PX520103",,,,,,,,,,"",""
"like_more_of_the_drug","px520103_phenx_acute_subjective_response_to_substances_current_gene",,"text","Would you like MORE of the drug you took, right now?",,"PX520103",,,,,,,,,,"",""
