"Variable / Field Name","Form Name","Section Header","Field Type","Field Label","Choices, Calculations, OR Slider Labels","Field Note","Text Validation Type OR Show Slider Number","Text Validation Min","Text Validation Max","Identifier?","Branching Logic (Show field only if...)","Required Field?","Custom Alignment","Question Number (surveys only)","Matrix Group Name","Matrix Ranking?","Field Annotation"
"phenx_abdominal_aortic_aneurysm_record_id","px041001_phenx_abdominal_aortic_aneurysm",,"text","Record ID",,"PX041001",,,,,,,,,,"",
"ever_have_abdominal_aortic_aneurysm","px041001_phenx_abdominal_aortic_aneurysm",,"radio","Have you ever been diagnosed by a doctor as having an abdominal aortic aneurysm?","UNDEFINED_CODE,Yes|UNDEFINED_CODE_1,No","PX041001",,,,,,,,,,"",""
"aaa_surgery","px041001_phenx_abdominal_aortic_aneurysm",,"radio","Have you had surgery or other repair for this aneurysm?","UNDEFINED_CODE,Yes|UNDEFINED_CODE_1,No","PX041001",,,,,"[ever_have_abdominal_aortic_aneurysm] = 'UNDEFINED_CODE'",,,,,"",""
"ultrasound_machine","px041001_phenx_abdominal_aortic_aneurysm",,"text","Ultrasound machine name and model.",,"PX041001",,,,,,,,,,"",""
"max_transverse_diameter","px041001_phenx_abdominal_aortic_aneurysm",,"text","Maximum transverse diameter (cm) of the aorta.",,"PX041001",,,,,,,,,,"",""
"max_anterior_posterior_diameter","px041001_phenx_abdominal_aortic_aneurysm",,"text","Maximum anterior-posterior diameter (cm) in the longitudinal plane.",,"PX041001",,,,,,,,,,"",""
"max_aortic_diameter","px041001_phenx_abdominal_aortic_aneurysm",,"text","Maximum aortic diameter (cm).",,"PX041001",,,,,,,,,,"",""
"ultrasound_image_id","px041001_phenx_abdominal_aortic_aneurysm",,"text","Ultrasound scan image ID.",,"PX041001",,,,,,,,,,"",""
