"Variable / Field Name","Form Name","Section Header","Field Type","Field Label","Choices, Calculations, OR Slider Labels","Field Note","Text Validation Type OR Show Slider Number","Text Validation Min","Text Validation Max","Identifier?","Branching Logic (Show field only if...)","Required Field?","Custom Alignment","Question Number (surveys only)","Matrix Group Name","Matrix Ranking?","Field Annotation"
"phenx_tinnitus_screener_record_id","px202001_phenx_tinnitus_screener",,"text","Record ID",,"PX202001",,,,,,,,,,"",
"tinnitus_lasting_minutes","px202001_phenx_tinnitus_screener",,"radio","Have you experienced tinnitus lasting more than 2-3 minutes?","UNDEFINED_CODE,Yes|UNDEFINED_CODE_1,No","PX202001",,,,,,,,,,"",""
"tinnitus_months_six","px202001_phenx_tinnitus_screener",,"radio","Have you experienced tinnitus for at least 6 months?","UNDEFINED_CODE,Yes|UNDEFINED_CODE_1,No","PX202001",,,,,"[tinnitus_lasting_minutes]='UNDEFINED_CODE'",,,,,"",""
"tinnitus_quiet_room","px202001_phenx_tinnitus_screener",,"radio","In a quiet room, can you hear tinnitus?","UNDEFINED_CODE,Always|UNDEFINED_CODE_1,Usually|UNDEFINED_CODE_2,Sometimes/Occasionally","PX202001",,,,,"[tinnitus_months_six]='UNDEFINED_CODE' OR [tinnitus_months_six]='UNDEFINED_CODE_1'",,,,,"",""
"tinnitus_cause_past_year","px202001_phenx_tinnitus_screener",,"radio","When you heard tinnitus this past year, was it caused by a recent event? (Examples: loud concert, head cold, allergies, some medications)","UNDEFINED_CODE,No|UNDEFINED_CODE_1,Yes, Sometimes|UNDEFINED_CODE_2,Yes, Always","PX202001",,,,,"[tinnitus_quiet_room]='UNDEFINED_CODE_2'",,,,,"",""
"tinnitus_cause_recent_event","px202001_phenx_tinnitus_screener",,"radio","Does your tinnitus seem to ""come and go"" on its own, in addition to being caused by a recent event(s)?","UNDEFINED_CODE, Yes | UNDEFINED_CODE_1, No","PX202001",,,,,"[tinnitus_cause_past_year]='UNDEFINED_CODE_1'",,,,,"",""
"tinnitus_frequency","px202001_phenx_tinnitus_screener",,"radio","How frequently do you experience tinnitus?","UNDEFINED_CODE,Daily or weekly basis|UNDEFINED_CODE_1,Monthly or yearly basis","PX202001",,,,,"[tinnitus_cause_recent_event]='UNDEFINED_CODE' OR [tinnitus_cause_past_year]='UNDEFINED_CODE'",,,,,"",""
