"Variable / Field Name","Form Name","Section Header","Field Type","Field Label","Choices, Calculations, OR Slider Labels","Field Note","Text Validation Type OR Show Slider Number","Text Validation Min","Text Validation Max",Identifier?,"Branching Logic (Show field only if...)","Required Field?","Custom Alignment","Question Number (surveys only)","Matrix Group Name","Matrix Ranking?","Field Annotation"
long_covid_symptoms_gastrointestinal_short_sick_stomach_vomitingrecord_id,px992012_long_covid_symptoms_gastrointestinal_short,,text,"Record ID",,PX992012,,,,,,,,,,,
long_covid_symptoms_gastrointestinal_short_sick_stomach_vomiting,px992012_long_covid_symptoms_gastrointestinal_short,,radio,"Do you still have the feeling sick to your stomach or vomiting?","UNDEFINED_CODE, Yes, I still have this symptom|UNDEFINED_CODE_1, Yes, I still have the symptom but it is less severe|UNDEFINED_CODE_2, Yes, I still have the symptom but it comes and goes|UNDEFINED_CODE_3, No, the symptom has cleared",PX992012,,,,,,,,,,,
long_covid_symptoms_gastrointestinal_short_sick_stomach_vomiting_normal_activites,px992012_long_covid_symptoms_gastrointestinal_short,,radio,"Does/did the feeling sick to your stomach or vomiting affect your ability to do your normal activities?","UNDEFINED_CODE, I have/had the symptom but I can/could still do normal activities.|UNDEFINED_CODE_1, I have/had the symptom but I can/could still do normal activities.|UNDEFINED_CODE_2, The symptom is/was very bad. I am/was not able to do activities that I usually do.|UNDEFINED_CODE_3, Refuse to answer",PX992012,,,,,,,,,,,
long_covid_symptoms_gastrointestinal_short_sick_stomach_vomiting_clear,px992012_long_covid_symptoms_gastrointestinal_short,,radio,"When did the feeling sick to your stomach or vomiting clear?","UNDEFINED_CODE, Less than 3 months after symptom started|UNDEFINED_CODE_1, Between 3 to 6 months after symptom started|UNDEFINED_CODE_2, Between 6 to 9 months after symptom started|UNDEFINED_CODE_3, Greater than 9 months after symptom started|UNDEFINED_CODE_4, Don't know|UNDEFINED_CODE_5, Refuse to answer",PX992012,,,,,,,,,,,
long_covid_symptoms_gastrointestinal_short_diarrhea,px992012_long_covid_symptoms_gastrointestinal_short,,radio,"Do you still have the diarrhea?","UNDEFINED_CODE, Yes, I still have this symptom|UNDEFINED_CODE_1, Yes, I still have the symptom but it is less severe|UNDEFINED_CODE_2, Yes, I still have the symptom but it comes and goes|UNDEFINED_CODE_3, No, the symptom has cleared",PX992012,,,,,,,,,,,
long_covid_symptoms_gastrointestinal_short_diarrhea_normal_activites,px992012_long_covid_symptoms_gastrointestinal_short,,radio,"Does/did the diarrhea affect your ability to do your normal activities?","UNDEFINED_CODE, I have/had the symptom but I can/could still do normal activities.|UNDEFINED_CODE_1, I have/had the symptom but I can/could still do normal activities.|UNDEFINED_CODE_2, The symptom is/was very bad. I am/was not able to do activities that I usually do.|UNDEFINED_CODE_3, Refuse to answer",PX992012,,,,,,,,,,,
long_covid_symptoms_gastrointestinal_short_diarrhea_clear,px992012_long_covid_symptoms_gastrointestinal_short,,radio,"When did the diarrhea clear?","UNDEFINED_CODE, Less than 3 months after symptom started|UNDEFINED_CODE_1, Between 3 to 6 months after symptom started|UNDEFINED_CODE_2, Between 6 to 9 months after symptom started|UNDEFINED_CODE_3, Greater than 9 months after symptom started|UNDEFINED_CODE_4, Don't know|UNDEFINED_CODE_5, Refuse to answer",PX992012,,,,,,,,,,,
