"Variable / Field Name","Form Name","Section Header","Field Type","Field Label","Choices, Calculations, OR Slider Labels","Field Note","Text Validation Type OR Show Slider Number","Text Validation Min","Text Validation Max","Identifier?","Branching Logic (Show field only if...)","Required Field?","Custom Alignment","Question Number (surveys only)","Matrix Group Name","Matrix Ranking?","Field Annotation"
"phenx_acculturation_record_id","px180101_phenx_acculturation",,"text","Record ID",,"PX180101",,,,,,,,,,"",
"how_well_speak_english","px180101_phenx_acculturation",,"radio","How well do you speak English?","1 , POOR|2 , FAIR|3 , GOOD|4 , EXCELLENT|8 , DON'T KNOW|9 , REFUSED","PX180101",,,,,,,,,,"",""
"how_well_read_english","px180101_phenx_acculturation",,"radio","How well do you read English?","1 , POOR|2 , FAIR|3 , GOOD|4 , EXCELLENT|8 , DON'T KNOW|9 , REFUSED","PX180101",,,,,,,,,,"",""
"how_well_write_english","px180101_phenx_acculturation",,"radio","How well do you write in English?","1 , POOR|2 , FAIR|3 , GOOD|4 , EXCELLENT|8 , DON'T KNOW|9 , REFUSED","PX180101",,,,,,,,,,"",""
"list_of_languages","px180101_phenx_acculturation",,"radio","To begin, what primary non-English language or dialect do you speak or understand?","1 , Spanish|2 , Chinese|3 , Vietnamese|4 , Tagalog|5 , Other","PX180101",,,,,,,,,,"",""
"list_of_languages_specify","px180101_phenx_acculturation",,"text","List of Languages:  Other Specify",,"PX180101",,,,,,,,,,"",""
"language_speak_with_friends","px180101_phenx_acculturation",,"radio","What language do you speak with most of your friends?","1, (LANGUAGE) ALL THE TIME | 2, (LANGUAGE) MOST OF THE TIME | 3, (LANGUAGE) AND ENGLISH EQUALLY | 4, ENGLISH MOST OF THE TIME | 5, ENGLISH ALL OF THE TIME | 8, DON'T KNOW | 9, REFUSED","PX180101",,,,,,,,,,"",""
"language_speak_with_family","px180101_phenx_acculturation",,"radio","What language do you speak with most of your family?","1, (LANGUAGE) ALL THE TIME | 2, (LANGUAGE) MOST OF THE TIME | 3, (LANGUAGE) AND ENGLISH EQUALLY | 4, ENGLISH MOST OF THE TIME | 5, ENGLISH ALL OF THE TIME | 8, DON'T KNOW | 9, REFUSED","PX180101",,,,,,,,,,"",""
"language_think_in","px180101_phenx_acculturation",,"radio","In what language do you think?","1, (LANGUAGE) ALL THE TIME | 2, (LANGUAGE) MOST OF THE TIME | 3, (LANGUAGE) AND ENGLISH EQUALLY | 4, ENGLISH MOST OF THE TIME | 5, ENGLISH ALL OF THE TIME | 8, DON'T KNOW | 9, REFUSED","PX180101",,,,,,,,,,"",""
