"Variable / Field Name","Form Name","Section Header","Field Type","Field Label","Choices, Calculations, OR Slider Labels","Field Note","Text Validation Type OR Show Slider Number","Text Validation Min","Text Validation Max","Identifier?","Branching Logic (Show field only if...)","Required Field?","Custom Alignment","Question Number (surveys only)","Matrix Group Name","Matrix Ranking?","Field Annotation"
"phenx_flavor_preference_ecigarettes_youth_record_id","px720602_phenx_flavor_preference_ecigarettes_youth",,"text","Record ID",,"PX720602",,,,,,,,,,"",
"pxt720602_first_ecig_flavor_indicator","px720602_phenx_flavor_preference_ecigarettes_youth",,"radio","Was the first e-cigarette you used flavored to taste like menthol, mint, clove, spice, fruit, chocolate, alcoholic drinks, candy or other sweets?","UNDEFINED_CODE, 1 Yes | UNDEFINED_CODE_1, 2 no | UNDEFINED_CODE_2, 8 Don't Know | UNDEFINED_CODE_3, 7 Refused","PX720602",,,,,,,,,,"",""
"pxt720602_first_ecig_flavor_choice","px720602_phenx_flavor_preference_ecigarettes_youth",,"checkbox","What flavor was that first e-cigarette? If multiple flavors were mixed together, choose all that apply.","UNDEFINED_CODE, 1 Menthol or mint | UNDEFINED_CODE_1, 2 Clove or spice | UNDEFINED_CODE_2, 3 Fruit | UNDEFINED_CODE_3, 4 Chocolate | UNDEFINED_CODE_4, 5 An alcoholic drink (Such as wine, cognac, margarita or other cocktails) | UNDEFINED_CODE_5, 6 candy or other sweets | UNDEFINED_CODE_6, 7 Some other flavor | UNDEFINED_CODE_7, 8 Don't know | UNDEFINED_CODE_8, 9 Refused","PX720602",,,,,,,,,,"",""
"pxt720602_thirthydays_days_ecig_flavor_indicator","px720602_phenx_flavor_preference_ecigarettes_youth",,"radio","In the past 30 days, [were/was] any of the [ECIGFILL2]* you used flavored to taste like menthol, mint, clove, spice, fruit, chocolate, alcoholic drinks, candy or other sweets?","UNDEFINED_CODE, 1 Yes | UNDEFINED_CODE_1, 2 no | UNDEFINED_CODE_2, 8 Don't Know | UNDEFINED_CODE_3, 7 Refused","PX720602",,,,,,,,,,"",""
"pxt720602_thirthydays_days_ecig_flavor_choice","px720602_phenx_flavor_preference_ecigarettes_youth",,"checkbox","Which flavors have you used in the past 30 days? Choose all that apply.","UNDEFINED_CODE, 1 Menthol or mint | UNDEFINED_CODE_1, 2 Clove or spice | UNDEFINED_CODE_2, 3 Fruit | UNDEFINED_CODE_3, 4 Chocolate | UNDEFINED_CODE_4, 5 An alcoholic drink (Such as wine, cognac, margarita or other cocktails) | UNDEFINED_CODE_5, 6 candy or other sweets | UNDEFINED_CODE_6, 7 Some other flavor | UNDEFINED_CODE_7, 8 Don't know | UNDEFINED_CODE_8, Refused","PX720602",,,,,,,,,,"",""
"ecig_flavor_ease_of_use","px720602_phenx_flavor_preference_ecigarettes_youth",,"radio","Some e-cigarettes come in flavors like menthol, mint, clove, spice, fruit, chocolate, alcoholic drinks, candy or other sweets. Are flavored e-cigarettes easier to use, about the same, or harder to use than unflavored e-cigarettes?","UNDEFINED_CODE, 1 Easier to use | UNDEFINED_CODE_1, 2 About the same | UNDEFINED_CODE_2, 3 Harder to use | UNDEFINED_CODE_3, 8 Don't know | UNDEFINED_CODE_4, 7 Refused","PX720602",,,,,,,,,,"",""
